<?xml version="1.0" encoding="UTF-8"?>
<dataroot xmlns:od="urn:schemas-microsoft-com:officedata" xmlns:xsi="http://www.w3.org/2001/XMLSchema-instance"  xsi:noNamespaceSchemaLocation="جدول1.xsd" generated="2025-01-26T12:49:15">
<جدول1>
<المعرف>1</المعرف>
<name>tamer</name>
<date>2025-01-26T00:00:00</date>
<nameot>فلاتر</nameot>
<no>1</no>
<sr>0</sr>
<qo>5</qo>
<newname>الى الورشة</newname>
</جدول1>
<جدول1>
<المعرف>2</المعرف>
<name>tamerp</name>
<date>2025-01-27T00:00:00</date>
<nameot>yui</nameot>
<no>5</no>
<sr>0</sr>
<qo>2</qo>
<newname>yyy</newname>
</جدول1>
</dataroot>
